{
  "name": "YesNo",
  "description": "A Yes/No decision point / outcome group.",
  "namespace": "basic",
  "key": "YN",
  "version": "1.0.0",
  "schemaVersion": "1-0-1",
  "values": [
    {
      "key": "N",
      "name": "No",
      "description": "No"
    },
    {
      "key": "Y",
      "name": "Yes",
      "description": "Yes"
    }
  ]
}
