{
  "namespace": "cvss",
  "version": "2.0.0",
  "schemaVersion": "1-0-1",
  "key": "A",
  "name": "Availability Impact",
  "description": "This metric measures the impact to availability of a successfully exploited vulnerability.",
  "values": [
    {
      "key": "N",
      "name": "None",
      "description": "There is no impact to the availability of the system."
    },
    {
      "key": "L",
      "name": "Low",
      "description": "There is reduced performance or interruptions in resource availability."
    },
    {
      "key": "H",
      "name": "High",
      "description": "There is total loss of availability, resulting in the attacker being able to fully deny access to resources in the impacted component; this loss is either sustained (while the attacker continues to deliver the attack) or persistent (the condition persists even after the attack has completed)."
    }
  ]
}
