{
  "namespace": "cvss",
  "version": "1.0.0",
  "schemaVersion": "1-0-1",
  "key": "CR",
  "name": "Confidentiality Requirement",
  "description": "This metric measures the impact to the confidentiality of a successfully exploited vulnerability.",
  "values": [
    {
      "key": "L",
      "name": "Low",
      "description": "Loss of confidentiality is likely to have only a limited adverse effect on the organization or individuals associated with the organization (e.g., employees, customers)."
    },
    {
      "key": "M",
      "name": "Medium",
      "description": "Loss of confidentiality is likely to have a serious adverse effect on the organization or individuals associated with the organization (e.g., employees, customers)."
    },
    {
      "key": "H",
      "name": "High",
      "description": "Loss of confidentiality is likely to have a catastrophic adverse effect on the organization or individuals associated with the organization (e.g., employees, customers)."
    },
    {
      "key": "ND",
      "name": "Not Defined",
      "description": "This metric value is not defined. See CVSS documentation for details."
    }
  ]
}
