{
  "namespace": "cvss",
  "version": "1.0.0",
  "schemaVersion": "1-0-1",
  "key": "AC",
  "name": "Access Complexity",
  "description": "This metric measures the complexity of the attack required to exploit the vulnerability once an attacker has gained access to the target system.",
  "values": [
    {
      "key": "L",
      "name": "Low",
      "description": "Specialized access conditions or extenuating circumstances do not exist; the system is always exploitable."
    },
    {
      "key": "H",
      "name": "High",
      "description": "Specialized access conditions exist; for example: the system is exploitable during specific windows of time (a race condition), the system is exploitable under specific circumstances (nondefault configurations), or the system is exploitable with victim interaction (vulnerability exploitable only if user opens e-mail)"
    }
  ]
}
